{"schema_version":"1.0.0-fixture","fixture":true,"operational":false,"active_branch":"main","feed_root":"schema-v1","major_feed":"data/schema-v1/major/events.json","approved_manifest":"data/schema-v1/approved/manifest.json","fallback_behavior":"Preserve last successfully loaded data and distinguish failure from zero events.","status":"ACTIVE"}